user,comment,like
클로즈-업,흠 잡을 데 없으나 실화의 재연 이상의 의미가 있는진 모르겠다,13
Yobi,"어느새 검은 돌과 흰 돌로 변하더니, 이 대국은 감히 명승부구나!",0
신상훈남,명품 스포츠 영화,47
ch'infelice sempre,이거 19금 걸어야 하는 거 아님?,0
콩칸,"250403

스승과 제자의 마지막 단어,
무심과 성의
정말 아름답네",0
안진완,"한겨울의 햇살처럼, 초봄의 함박눈처럼 차가우면서도 따듯한 승부의 세계.",0
너구리마요네즈,미묘한 사제지간의 긴장감을 잘 그려냈다.,0
김윤자,"2025.04.03
바둑이라는 이야기로 이렇게 많은 걸 담을 수 있다고??
나는 바둑을 전혀 모른다. 그럼에도 불구하고 지루함 없이 오히려 팽팽한 긴장감을 느끼며 영화를 봤다. 응답하라 시리즈를 보면 바둑안에 인생이 다 들어있다고 한다. 이 영화에도 인생이ㆍ사람이 들어있다.
사제지간에도 프로라면 승부에서 이겨야 하는거라는걸 분명히 하고있다. (한화이글스 선수들에게 이 영화를 보여주고 싶네...ㅠ.ㅠ) 경쟁에 있어 막강한 라이벌이라는 것이 좋은 자극제가 되는 건 확실한 것 같다. 사람이기에 가질 수 있는 마음도 있으니까...
연기 잘하는 배우들이 총출동해서인지 단단한 영화를 본 것 같다. 유아인의 얼굴에서 김강훈의 얼굴이 보이다니... 내 눈이 이상한건가? 그만큼 비슷한 표정ㆍ비슷한 말투ㆍ비슷한 행동을 연구했겠지~~
재미없을 것 같은 내용이라 생각했었는데 그건 내 편견이었다. 나에겐 오히려 좋은 에너지를 준 영화였다.",3
Isoh,"청출어람이란 제자가 스승을 뛰어넘는 것이 아니라
서로가 서로의 스승이자 제자가 되는 것

승부란 이기기 위해 죽도록 임하면서도
승패에 '무심'하게 경기에 '성의'를 다하는 것",0
수첩,그날의 승부를 직관하는 듯한 생생함.,2
푸른용칠이,"개인이 관람에대한 벽을 하나 만들어 놨지만
아주 훌륭하다 바둑으로 칼싸움없이 이런 긴장감과 연출이라니 너무 만족스럽게 본 영화",0
군고구마,"밀레니얼 세대는 임요환 vs 최연성 생각하면 되겠다. 안타깝게도 임요환은 타이틀을 회복하지 못했지만..

신파도 없고 담백하게 치고 나가서 좋았다",0
진32,25.03.28,0
미래영화감독,대국 한 판보다 치열한 흑과 백의 우열을 가릴 수 없는 연기 대결.,1
HJ_Yun,"결말이 정해진 이야기의 개성을 극대화한 등장인물들. 조훈현 같았던 이병헌, 이창호가 겹처 보였던 유아인.",1
진현수,"자칫 지루할 수 있는 사제 간의 바둑 대결을 몰입감있게, 때론 과감하고 스피디하게 다룬다.",0
FFF,연기 승부는 치열하지만 영화는 싱겁다,0
Buff,후세에 임요한 페이커 버젼의 <승부>가 나오길 기대하며..(단순히 재미로만 따지자면 <신의한수> 보다는 부족했다.),0
할지도,"욕먹더라도 어쩔 수 없다 유아인 사면해줘야 함 ㅜㅜ
얼굴은 어케 연기하는건데
점점 이창호 얼굴이 보임",0
수희,노잼 ㅠㅠ,0
로제이(LoJ),최고의 스승은 제자를 통해서도 배우고 성장한다.,1
요닝구,연기천재,0
사이다,"누가 먼저 평정심을 잃을것인가
P.S. 바둑도 연기도 서로 씹어먹는다",0
김어진,"승부와 인간, 감정의 극",0
걸핏자,살짝 졸리긴함..,0
박상민,"바둑 좋아하는 사람으로써, 싱크로율에 놀라고

모든 등장인물의 호연을 바탕으로 쫄깃하게 잘 봤다.

2시간이 어떻게 갔는지 모르겠는 수작",0
Eun-Young Kim,"시대의 교체
유아인 배우의 복귀를 기원합니다",0
나연,밀려오는 졸음과의 승부,2
추교민(오이),"사제지간에서 사활을 가르는 관계로,
바둑대결에서 연기 대결로도
묵직히 그리고 담담히도 이어진다.

25.04.03.(목)
CGV",10
태흔,연기로는 깔 수 없음,0
정다정,청출어람이로군. 바둑 배우고싶어짐. 유튜브로 진짜 저 때의 다큐보니 영화화를 잘했더군.,0
김태효,"바둑판이 나의 보물1호던, 바둑학원을 다니던 시절 열심히 따라두던 기보속 두 기사들의 실화 이야기여서 추억에 빠지는 시간이였다.
연기로는 깔수없는 두 배우의 연기는 역시 좋았고, 바둑에 대한 자세한 설명없이도 대국상황에서 긴장감을 유지하게한 연출도 나름 괜찮았다.
추억과 극장 가점으로 별 4개",0
유영재,"너무나 멋진 스토리, 그리고 빛나는 연기.",0
서경호(KRONE),부족한 최고란 숭고하고 아름답다.,1
YBDB,화려함보단 기본기로 만든 영화. 연출이 한 몫했다.,0
영화보는 게 재밌는 남자,재미있어요.,0
슈퍼똥개,다소 상투적인 복기.,0
트리블레스,"폭발하듯 휘어잡는 기세 사이로 드문드문 보이는 급소

-2025.04.02 @롯데시네마 청량리 5관",0
찬찬,영화관에서볼수있어서 좋았음,1
예솔,마음을 비워라,0
DW,자만하지 않게 내려준 운명,0
Travis,25년 3월 24일 소개,0
민트초코도둑,대국 연출이 야무지다.,1
박태경,"시작부터 누구나 예측 가능한 스토리라인을 따라가지만 예상 가능한 자극을 빼면서 연출과 연기만으로 영화를 탄탄하게 채운다. 바둑에 대한 이야기가 아닌 승부에 관한, 인생을 살아가는 방식에 대한 이야기이고 영화는 정답을 제시하지 않는다는 점이 좋았다.",1
상너무식기,"정석적 포석의 연출
힘 있는 행마의 두 배우",1
SuHyunKim,"심야영화로 롯데시네마 도곡에서 갑자기 본 영화
항상 영화에 대한 코멘트를 했는데… 그냥 이번엔 이렇게봐서 좋았다는 글을 남기고싶다",1
최재우,"바둑판 위에서 벌어진 일들을 한 수 한 수 담담하게 써 내려가지만, 바둑돌이 부딪히는 치열함이 느껴진다.",1
명정,관계와 기풍의 역전을 살리는 놀라운 기교. 대사에 의존하는 아쉬운 대국 묘사.,3
오형석,승리는 부지런한 사람의 것.,1
수연,"무심, 성의.",1
오수영,난 여태까지 뭐 하나 스승을 이겨본게 없었네?,1
배우는배운다,명연기로 회자될 명국,1
KCW,‘마음을 비우되(無心) 마음을 다하는(誠意)’ 승부의 묵직함,5
남현성,뭐든지 뚫는 창과 절대 뚫리지 않는 방패의 승부를 보는 기분.,0
까마기,똥영화 그만 만들어라,1
킴 클라우스,"깊게 들어가지도 못하고, 평작 수준. 고급 재료로 평범한 맛.",2
우진,"아쉬움 없는 연기, 아쉬움 남는 연출.",1
Loveimaeumi,조우진의 안정적 연기 위에 이병헌이 마음껏 춤을 춘다.,0
u3u,그 시절의 향수를 불러오는 이병헌과 유아인의 연기력은 알면서도 사제대결에 땀을 쥐고 보게 만들고 더 추가할것도 없이 자칫 지루할 수 있었던 연출을 연기로 밟았다.,0
Bom,알파고의 ㅇ조차 없었던 시대의 승부엔 낭만이 넘쳤었네.,3
Leesang,"제자로만 남아있으면 스승에게 누를 끼치는 것이다. - [차라투스트라는 이렇게 말했다, 니체]",0
Shagra,"무리수도 묘수도 없는 연출, 화점마다 착점하는 배우들.

""배우려 하지 말고, 이길 궁리를 해봐.""

25.04.01.(화) CGV 용산아이파크몰.",1
마린,승부는 내가 이기고 지는 것이 아니라 내가 단단해질 것인가 부서질 것인가의 싸움이다.,1
이태윤,"바둑을 모르는 사람들에게도 바둑의 고뇌와 승부의 숨막힘을 캐릭터, 미장센, 연출에 빠짐없이 녹여낸 전달력만으로도 큰 성공.",1
김진호,"좋은 연기와 좋았던 시절이 만나니

아름답다",0
무야,딱 반집 이긴 영화,0
박현우,차갑고도 뜨겁게 펼쳐졌던 두 전설의 승부를 기막히게 재현한 솜씨란,0
🤡🤡,승부는 이렇게.,0
신준식,이병헌보다 유아인 연기가 더 좋았다.,0
쭈..,연기는 잘하드라,0
김재,"정점에 올라있는 사람도 , 정점을 향해 가는 사람도 성장을 한다. 다만, 성장을 위한 퇴보도 한다.",0
noey0815,"이병헌 유아인 조우진 세 사람의 연기만으로도
충분히 승부를 걸만한 영화였다
지루할 거라 예상했으나 지루하지 않고
바둑판이 우리네 인생판 같아서 뭉클하기까지..
인생 최고의 영화는 아니지만
가끔은 꺼내 보고 싶은 좋은 영화",0
권민서,"연출 + 카메라 구도
박수를 드림",0
Martin,"졸리다 졸려
유아인은 이창호 삼킨줄👍🏼",0
쉼표,"잔잔하지만 처지지 않게 반집을 끌고 나아간다,",0
Just2s,"영화 문법, 미장센의 선생님을 만나 벽을 느낀다.
기초대로 공격적이다.

미술에서 완벽을 느낀다.
조명에서 절대 따라갈 수 없음을 느끼고
촬영에서 딱 반집승이 보인다.

영화를 이겨야겠다 나는

끊고있던 담배를 다시 물었다.",0
내 맘대로,이병헌 특유의 능청스러운 연기가 좋았다.바둑이라는 자칫 지루할 수 있는 소재로 긴장감을 끌어낸 것 굿..그러나 퀸스갬빗이 더 재밌었다,0
김진우,"바둑보다 배우들이 연기한 사제간의
마음이 더 더 돋보이는 영화",0
율마,주연 배우에게만 기댄 게으른 영화 ..,1
김박복복,내가 선생이야 누니야!!,0
그냥흘러가는대로가보자,이게 집중이 되네,0
여우,"이병헌은 명불허전.. 마지막에 실사랑 싱크로가 미쳤다
영화 제목처럼 거짓말같은 스승과 제자의 승부. 긴장감 넘치면서도 큰 갈등 없이 따뜻한 느낌만 자아내는 정말 좋은, 잘 만든 영화였다",0
카니형,-CGV동탄역-,0
콘스탄티노플,영화는 코스프레가 아니다~,0
fim,답이 없지만 답을 찾으려는 노력 지금에 나에게 너무 와닿았다,0
송버,아버지 같은 스승과 아들 같은 제자,0
이한승,두 배우의 연기로 시작해서 연기로 끝,0
말주변,피 튀기지만 진부한 승부,0
jyjea,팽팽한 연기의 승부로 재현한 전설의 사제대국...,7
서민우,이런게 연기 티키타카,0
수용,이거는 재미잇다,0
휑~,"가슴 쫄깃쫄깃 하게 만들어…
바둑 하나 몰라도 해설 있어서 볼 만 한듯",0
도윤,요동치던 바둑알이 이윽고 움직임을 멈추듯 전반을 조율하는 명연기.,0
유지환,마지막 대국은 탁구 경기를 보듯 숨이 막힌다,0
이권영,스크린에 이병헌과 유아인이 아니라 조훈현과 이창호가 있었다. 너무 아쉽다 마약을 왜 해서.,1
J1,유려한 포장에 감춰진 날카로운 감정들,0
Hyun Ko,"그들의 승부
그리고 자신과의 승부",0
관우,"우리네 삶은
스승과 제자로 이루어지는 한 판의 승부다

ps) 흑과 백의 단순함, 그 힘",0
우상조,두명이 연기를 너무잘한다,0
Kyle,기세를 통해 타고 흐르는 고뇌와 아집을 정갈하게 실어내다.,3
남의주,유아인 대체자 없다,0
그냥보자,이렇게 찍어서 보여줄 거면 다큐멘터리가 더 효과적이지 않을까? 배우들의 호연 말고는 많은 부분 아쉽다.,3
C NH,머신러닝으로 만든 영화같다.,0
이현석,안닮았는데 닮았어요,1
내가 영화를 만났을 때,흑의 그림자에서 자라나 백의 빛을 삼켜낸다.,2
KYEONG,확실히 논란이 있어도 연기는 잘해…,0
왓챠주무관,"내용은 좋지만 재미가 없고 긴장은 있지만 스릴이 없다.
다큐보다 못한 전달력.
바둑처럼 지루하고 낡았을 뿐이다.",4
지운,"파편적으로 떠오르는 영화에 대한 감상들.. 두려움과 평정심, 전투, 자신과의 싸움, 물러섬이 곧 패배, 바둑이 곧 인생.. 이런 것들은 모두 미뤄두고, 이 영화를 본 뒤 피운 담배는 참 맛있었다.",0
자캐오,사제지간에서 볼 수 있는 긴장감을 볼 수 있어 좋았다 특히나 배우들이 하나같이 연기를 잘해서 흥미 있게 봤다,0
방토,오랜만에 괜찮은 작품 나온 듯. 보러가야지!,0
정구민,"바둑은 잘 모르지만 숨 죽이게 만든다.
인생도 잘 모르지만 마음을 비우고 최선을 다해
내 자신과의 싸움에서 이겨보려한다.",0
TonY,"정상에서 떨어진 자는,
그 절망을 어떻게 마주했는가",1
woony,정공법 연출이 정면승부를 회피하지 않는 극중 인물들의 태도와 맞물려 단단한 성취를 끌어낸다.,0
이주언,"무난무난한 실화영화에다가 연기력이 더해짐.
바둑을 좋아한다면 더 재밌게 볼 수 있음.",0
댄디큐티,"왜 극장 개봉을 고집했는지 이유 있는 완성도를 자랑하고 있습니다.
이병헌도 그렇고, 유아인 또한 악마적인 재능으로 깔 수가 없는 실존 인물을 그대로 옮겨놓은 연기를 선보이고 있습니다.
뒤늦게서야 빛을 보는 창고 영화!
제 2의 소방관이 되시기를...",0
k.,"연출 짱!!!!!! 영화관에서 보세요 :>
(+ 이병헌 유아인 연기 차력쇼 ㅁㅊ음..)",0
이준석,영화로 무난한 재미를 주는 법,1
이정훈,‘승부’에 방점을 찍고 담백하게 만들어 낸 종합 예술.,0
하늘연달스물사흘,"사전 정보가 없어도 충분히 괜찮은 영화지만
조훈현 9단과 이창호 9단을 알고 있다면 더 재밌게 볼 수 있는 영화",0
히윤,또 다른 천재를 낳는 천재.,0
홍천뚝배기,이깟 돌 하나에 웃었다가 울었다가.,0
kimsung__,완벽한 맞수를 만났을 때 나오는 절망적인 무력감 또는 희망찬 기대감.,0
지광훈 평론가,25. 04. 02/204 만듦새란 이런 것.,0
강신종,정적인 바둑의 긴장감을 돋군 배우들의 호연과 담백한 연출이 압권,0
오승용,"높이 올라가기 위해서
깊이 내려가는 순간이 존재한다.

조훈현 이창호 둘다
깊이 내려가봤기에
높이 올라갈 수 있었지 않을까

마치 내 인생같아보여서 이입이 더 잘됐다.

뉴진스님의 말씀이 떠오른다.
제행무상",0
SiHyeonAn,내용보다 배우들의 연기력이 좋았다.,0
DongJun,사제지간으로 만나 수어지교가 되다.,0
Son,사제 관계도 무색해지는 승부사들의 세계,0
여움,정해져 있는 수에도 물러서지 않는 대단한 기세,0
정혜민,연기가 ㅁㅊ닼ㅋ,0
이순,"롯데시네마 신림에서
용민이랑 봤다
비겁할 정도로 재밌게 만들었다",0
교동모드리치,,0
뇸뇸냠,바둑 문외한인데도 지루함 없이 승부와 스토리를 따라가면서 보게 됨. 이병헌과 유아인의 연기 승부인 듯,0
차아안소오올,"다좋은데....조연으로 농담따먹기 하면서 영화 무게감 떨구는 한국영화 종특은 진짜 죽어도 못버리는구나, 재미가 있으면 몰라도 몰입감만 떨구는 것 같은데.",0
최호빈,박수도 두 손이 있어야 칠 수 있는 것,1
윤느,"유아인이 처음으로 화면에 등장했을 때
그의 사생활이 안개처럼 뿌옇게 시야를 가리려고 했다.
그리곤 눈이 은근히 찌푸려지며 유아인을 보기 꺼려 했다.
몇 초가 지나자 내 얼굴에 주름들이 다 펴진 게 느껴졌고,
나는 납작한 바둑판이 되어 저들이 두는 돌에 짓눌린 채 숨죽일 수밖에 없었다.",1
서주원,"스승과 제자, 배우와 배우의 소리 없는 총성이 스크린 밖으로 폭발적으로 뿜어져 나온다.",8
박혜빈,이게 존나 아름다운 영화야 병신들아,0
직한,"자극 없는 긴장감으로 그리는
승부의 신통방통 묘수풀이.",1
혀니르,"훌륭한 재현을 넘어, 다큐에서 볼 수 없는 인물의 이면을 드러내는 연기는 좋았다. 그런데 영화와 연출 스타일이 별로 어울리지 않는다.",0
미드20,틈이 보이지만 친절한 각본과 틈이 없는 연기들,1
곰돌이,나도 그런 승부를 겨룰 수 있는 사람이 되고싶다,1
UM,'묘수'도 '무리수'도 없이 연기 고수들의 명연을 착실하게 담아내는 '성의(誠意)'.,2
침착하마,서로가 서로에게 가르침을 주는 훌륭한 사제지간,1
김승현,"각자의 삶을 증명하는 과정, 바둑이란 방법",3
권예원,"니가 선생이면 다야? 애 구박하지마.
내가 나에게 하는 이야기.",1
신동윤,배우가 한 영화에서 차지하는 양감과 질감.,0
이한울,정적이지만 어떤 스포츠보다 뜨거웠다. 나도 저런 뜨거운 무언가를 할 수 있을까?,1
달새,"사운드트랙은 좋았다
대본이 제목을 너무 의식한다",2
밤에먹는달,"해답이 없는 승부에
각자만의 해답 으로 승부를 건다.",1
설이,손에 땀을쥐게하는 스릴러영화,1
진우주,배우의 연기에서 실존인물이 보인다,1
포뇨,"메인 테마가 흐를 때마다 영화 '아가씨'가 떠올라 떨쳐내기가 어려웠다.

""겨울이면 훔친 가죽 지갑들을 엮어 외투를 만들었다는 유명한 여도둑의 딸. 저 자신도 도둑, 소매치기, 사기꾼.
내 인생을 망치러 온 나의 구원자, 나의 타마코, 나의 숙희.""

* 음악 감독이 같다. 조영욱 감독",1
정지웅,승자를 위해 기뻐할 수 없는 침묵의 관객석,2
normal,"특히 체스, 바둑 같은 거 좋아하고, 특히 머리 쓰는 스포츠라 천재들 나오고 겨루는 스탠스를 좋아함. 그걸 적당히 잘 구현했고 스승과 제자의 관계성은 좋았으나 기타 인물들과의 서사는 많이 부족한 느낌. 그래도 잘 짜여진 바둑 영화 그리고 인물 영화 (?) 개인적으로는 본인이 손수 가르친 제자에게 10년 넘게 지켜온 자리를 넘겨주는 과정에 집중해서 봤다. 아무렇지 않을 수는 없지만 어떻게 받아들여야하는가에 대해서..",0
소희,"ai가 없던 그때 그시절 간지 1황 스포쓰
바둑과 전주를 알면 조금 더 재밌게 볼 수 있다 그럼에도 진부한 연출과 맥없는 마무리에 아쉬움이 큼",0
김정모,바둑의 매력을 한껏 높이는 배우들의 열연,0
jayden,연기차력쇼,1
영화 한 잔 A cup of film,사제여도 식구여도 프로 세계의 승부는 매섭고 심정은 복잡해진다,0
chan0lee,"기교 같은거 없이
배우 두 명만 가지고도 영화를 이렇게 완성할 수 있다",1
나연,"고스트바둑왕이 옛날 애니지만 잘 만든 애니구나 싶었다.
바둑은 하나도 모르지만 고스트바둑왕을 보고 봐서 그런지 대충은 룰을 알아서 더 재밌었다",1
Glix,정석적으로 공격적이거나 창의적으로 수비적인 영화를 기대했으나 정석적으로 수비적인 영화였습니다.,0
홍진호,연기만으로 몰입감 미친 승부,1
바르다,"국뽕점수 플러스
실제로는 어떠했든 적재적소 잇 (모든)배우연기 플러스
한국영화 화이팅!",2
Joong Hyun Park,태산과 파도가 검고 하얗게 조각난다,1
정하진,"최고로 산다는 건, 언제든 떨어질 불안과 함께 사는 것.",1
영로콩,"조훈현의 ""Last"" 댄스.
""마지막"" 에서 ""지속""으로",1
윤재희,"한 시대를 끝내고 새로운 바람을 불어오게 하는 한 점,
그 한 점의 이름은 애증이어라",2
STEEM,"빗 속에 내부자들의 두 배우
언제나 충고는 조우진의 몫",1
ㅎㄷㅎ,"조훈현이 이병헌했고, 이창호가 유아인했음.",1
Happiness,신들린 연기,2
승주,뜨겁다……………………………….,1
하쯩,"무심(無心): 마음을 비운다.
성의(誠意): 마음을 다한다.",0
최성현,"바둑이 이렇게나 재밌는 지 몰랐는데 하고 싶진 않았다.
어느 분야든 천재의 벽은 높다. 나는 잘할 수 있을까",1
따뜻한 회색 아이스티,이미 오래전부터 인정하고 있었다는 묵힌 고백이었다,0
도담왕대장,본격 금연 권장 영화,2
HYOMJAA,무사가 패배할순 있으나 도망치는 자가 무사일순 없다.,1
코신,"뭐랄까.. 좀.. 깊이가 안 느껴진달까..?
연기를 잘해도 그냥 겉핥기같은 느낌적인 느낌.",1
김동욱(wookie),"연기를 승부하네...
스승 윈",1
Wonderfool,영화 후반부는 클래식 한국영화였다. 물론 안좋은 쪽으로,0
Nam,"바둑판 위에서 치고받고 싸워도, 흑돌이 놓이지 않고서는 백돌을 둘 수 없기에",1
조치연,조훈현의 인간적인 심리변화에 녹아 들수 있었다. 이병헌(조훈현)과 유아인(이창호)의 연기가 사실과 흡사해서 몰입할 수 있었다.,1
2강2,"바둑을 알고 봤으면 확실히 더 좋았을 것 같긴 하지만 그럼에도 몰입감이 좋긴 하다. 바알못 입장에선 좀 길긴 함.

어떻게 키웠으면 그렇게 까불거리던 애가 저리 조용해졌음… 바둑의 힘인가?

이병헌 배우의 목소리는… 뭔가 이 사람은 연기하려고 태어난 사람 같음.

마지막 실제 인물 보니 강훈이 닮은 것 같애ㅎㅎ 유아인도 무슨 느낌으로 표현한지는 알겠는데 마약범인 거 알고 보니 그냥 금단 현상 온 사람 같고 집중이 좀 깨지긴 했음…

고창석 배우는 항상 감초 역할 조연만 하는 것 같네.",0
장석환,"어쩌면 심심할 수도 있는 이야기를
맛있게 만들어 냈다

연기와 연출로",0
감정과잉,"실화 바탕에 바둑이 소재라
극적으로 뭔가를 보여주기 힘들텐데
연기로 그걸 해냅니다 우와",1
Junsik Choi,너무 급하다.. 보여줘야할 검정은 많고 서두르니 아쉽다..,0
김지용,휼륭한점은 휼륭하되 너무 안전한 영화,0
김승혁,"이병헌에게서 조훈현이
유아인에게서 이창호가 보이는 게
그저 감탄만 나올 뿐이다.",1
이순준,사람들은 대부분 조훈현과 같지않게 좋은 어른이 되려는 순간에 등돌린다,1
준호,냉정함 속에서 단단히 버티는 서로를 향한 온정.,1
네리찌푸,분위기를 연기하는 배우란,0
류지훈,"흥미로운 소재, 준수한 연기.",10
진우,"조훈현은 제자가 아닌 또다른 나 자신을 키우고 있었던 것이 아닐까.
이창호라는 인물으로 바둑을 통해 어린 자신을 복기한다.",2
한선규,먼지 터는 것조차 숨죽이고 살 떨리는 전설이란.,0
김세진,대마를 잡기 위해서 호기롭게 돌을 잡았지만 손에 잡히는 것은 고작 패감이다.,0
luckyhyh,"""유아인 스캔들을 잊게 만들며 극에 몰입하게 만드는 탄탄한 연출과 배우들의 열연""

'이병헌'과 '유아인'의 압도적인 연기로, '조훈현'과 '이창호'가 겪는 다양한 심리변화를 입체적으로 보여주며 관객들을 몰입시키는데 성공하고,

​여기에 다양한 기법으로 보여주는 바둑 대국, 깨알같은 재미를 주는 조연급 연기자들의 활약은 영화를 더욱 풍성하게 해준다.

​하지만, 큰 긴장감 없이 안정적으로만 이어지는 서사와 설명 부족한 '조훈현'의 감정 변화 등은 큰 재미를 느끼기 어렵게 만들고,

​바둑을 전혀 모르는 관객들의 경우 중요한 바둑 대국 장면에서는 충분히 몰입하기 어려울 수 있다는 점은 아쉬운 부분이다.",2
하똥개,실화가 품고있는 한계가 선명하다.,0
블빌,"흐트러짐 없이 기백이 살아있는 두 연기파 배우들의 연기력 승부. 연출도, 몰입감도 기세가 모여있다.
[1회차: Laser 2D 개봉관]",1
